[
  {
    "index": 0,
    "type": "migration_wave",
    "payload_hash": "e789be225647d4ba8adde1ba5a0108f88b871231a5cb4e7f21c9fc8cda3a5518",
    "prev_hash": "0000000000000000000000000000000000000000000000000000000000000000",
    "sig_mldsa": {
      "algorithm": "ECDSA-SHA256",
      "status": "FALLBACK_CLASSICAL",
      "public_key_encoding": "der-base64",
      "public_key": "TUZrd0V3WUhLb1pJemowQ0FRWUlLb1pJemowREFRY0RRZ0FFQXk0VXpDeUpYZ3pqL2VINEFTR09Odm5SVmdrOE90SXFXa3pvZ0hjRmJ0OCtOT3VCaExRSGtqQllHQnd4K2VRamg0SnB6VEZPR3V5UUlodnVPd1l5R3c9PQ==",
      "signature": "MEUCIAHJ4NoZjx3XtriNKd6yi9yv5l4Nxf/rQGTHDHAUqSgBAiEAwrag4mQGFnJKnbzrclGbVN0Kp2wA1B9yu1UkIIrG6X0="
    },
    "ts": "2026-10-28T19:05:16.004618Z"
  },
  {
    "index": 1,
    "type": "migration_wave",
    "payload_hash": "6309bb4d7d2f88ed7b7abe85cb191ff4a455ce491690edea10a6235d2518ee7e",
    "prev_hash": "7dc474b871429e90595e1d49756e8f0284b3e0bcb7006a36e25e77837b95e46f",
    "sig_mldsa": {
      "algorithm": "ECDSA-SHA256",
      "status": "FALLBACK_CLASSICAL",
      "public_key_encoding": "der-base64",
      "public_key": "TUZrd0V3WUhLb1pJemowQ0FRWUlLb1pJemowREFRY0RRZ0FFQXk0VXpDeUpYZ3pqL2VINEFTR09Odm5SVmdrOE90SXFXa3pvZ0hjRmJ0OCtOT3VCaExRSGtqQllHQnd4K2VRamg0SnB6VEZPR3V5UUlodnVPd1l5R3c9PQ==",
      "signature": "MEYCIQDjbYxjfLP1u5lkx/EvHFNnTBEFbdr32z0NTwFIrHAx+wIhAMV5ucCBRRqSYIPK/0740viELbyKCO+DUAOGVJe3HnW2"
    },
    "ts": "2026-10-28T19:05:16.024308Z"
  },
  {
    "index": 2,
    "type": "migration_wave",
    "payload_hash": "965e43ace32b11dd3fb0af4599fe91a42927bc29843669f3040c0f75a36802ee",
    "prev_hash": "68f557e6e9f5f68cafcf8082e5b3b8f5f6f4533c1c40850981ae0546599ee94e",
    "sig_mldsa": {
      "algorithm": "ECDSA-SHA256",
      "status": "FALLBACK_CLASSICAL",
      "public_key_encoding": "der-base64",
      "public_key": "TUZrd0V3WUhLb1pJemowQ0FRWUlLb1pJemowREFRY0RRZ0FFQXk0VXpDeUpYZ3pqL2VINEFTR09Odm5SVmdrOE90SXFXa3pvZ0hjRmJ0OCtOT3VCaExRSGtqQllHQnd4K2VRamg0SnB6VEZPR3V5UUlodnVPd1l5R3c9PQ==",
      "signature": "MEUCIQCeKqlAhjGOCXHc2yKHs42/8skz15fxu31xW0QuZ7h5+AIgSaX5VkqANPIUjH4LQUMiC9/4UZSUAhcLxH1NHyEMOGU="
    },
    "ts": "2026-10-28T19:05:16.026366Z"
  },
  {
    "index": 3,
    "type": "migration_wave",
    "payload_hash": "5e89a6081ffe52aeed13a57e8a802011dc6d8bf8d618e81145905c1c60b683d7",
    "prev_hash": "015cf436c62b15522c9f05c578f8c47edd03a57c9134435b044d00b0a22beaa9",
    "sig_mldsa": {
      "algorithm": "ECDSA-SHA256",
      "status": "FALLBACK_CLASSICAL",
      "public_key_encoding": "der-base64",
      "public_key": "TUZrd0V3WUhLb1pJemowQ0FRWUlLb1pJemowREFRY0RRZ0FFQXk0VXpDeUpYZ3pqL2VINEFTR09Odm5SVmdrOE90SXFXa3pvZ0hjRmJ0OCtOT3VCaExRSGtqQllHQnd4K2VRamg0SnB6VEZPR3V5UUlodnVPd1l5R3c9PQ==",
      "signature": "MEYCIQD652OpQhVcJDd3cC5x5AsHrxr9/u+sjt6rl901fBPOnAIhAIP64CJB2Mxqi3EZVRMCu9J33z9a5TDEt6ght+ojrn0X"
    },
    "ts": "2026-10-28T19:05:16.028660Z"
  },
  {
    "index": 4,
    "type": "migration_wave",
    "payload_hash": "b43a8b7eadbfc2fd3c55ccdd92ee98cf84cd5dc5d98d0a5c99b03c5299bd6045",
    "prev_hash": "70b38ddfb491da20ed62a6032a309de2e9170f4491ded8b01acfa6f57821dee9",
    "sig_mldsa": {
      "algorithm": "ECDSA-SHA256",
      "status": "FALLBACK_CLASSICAL",
      "public_key_encoding": "der-base64",
      "public_key": "TUZrd0V3WUhLb1pJemowQ0FRWUlLb1pJemowREFRY0RRZ0FFQXk0VXpDeUpYZ3pqL2VINEFTR09Odm5SVmdrOE90SXFXa3pvZ0hjRmJ0OCtOT3VCaExRSGtqQllHQnd4K2VRamg0SnB6VEZPR3V5UUlodnVPd1l5R3c9PQ==",
      "signature": "MEQCIDM7ytJ0sDed4ti/w593ZJBQVtp8xXo1e/o+KHT9D+BdAiANWKzwIRG8K5dTuXuHmIVI0Ge3YYuhkJcsQygA5vTb9A=="
    },
    "ts": "2026-10-28T19:05:16.033204Z"
  },
  {
    "index": 5,
    "type": "migration_wave",
    "payload_hash": "bd43229d384fd82075751486d64eda86886332e70457f12b05736d2b63609a9a",
    "prev_hash": "563d01397e4e320c6e249309fadc3b2d45d7497f2e14c389b9fa8262a7982220",
    "sig_mldsa": {
      "algorithm": "ECDSA-SHA256",
      "status": "FALLBACK_CLASSICAL",
      "public_key_encoding": "der-base64",
      "public_key": "TUZrd0V3WUhLb1pJemowQ0FRWUlLb1pJemowREFRY0RRZ0FFQXk0VXpDeUpYZ3pqL2VINEFTR09Odm5SVmdrOE90SXFXa3pvZ0hjRmJ0OCtOT3VCaExRSGtqQllHQnd4K2VRamg0SnB6VEZPR3V5UUlodnVPd1l5R3c9PQ==",
      "signature": "MEYCIQDdZCwjhuHREUH7PP0HFGnRTMVex5/7EdX4Gg1QicoRHAIhAJP9iienyc7vrRse/wzf+s8hPCZKeJ3D/ObVpRm0r+qJ"
    },
    "ts": "2026-10-28T19:05:16.035987Z"
  },
  {
    "index": 6,
    "type": "run_manifest",
    "payload_hash": "c6c5cbbdbc8ba956fc12b385123c8e914e3d9a917bcef40020b47a303bcada58",
    "prev_hash": "b2d3d3c559f9fb589e9a4663293e17dc7b8f808022ebcc220476a5e824d2fc24",
    "sig_mldsa": {
      "algorithm": "ECDSA-SHA256",
      "status": "FALLBACK_CLASSICAL",
      "public_key_encoding": "der-base64",
      "public_key": "TUZrd0V3WUhLb1pJemowQ0FRWUlLb1pJemowREFRY0RRZ0FFQXk0VXpDeUpYZ3pqL2VINEFTR09Odm5SVmdrOE90SXFXa3pvZ0hjRmJ0OCtOT3VCaExRSGtqQllHQnd4K2VRamg0SnB6VEZPR3V5UUlodnVPd1l5R3c9PQ==",
      "signature": "MEUCIHcoaKDDa9W3TIdfz4q+jV0wUediAxAZFk9oufuad0gVAiEAqG3uiUwCy75HpNaqKt8U+a3dPjO+CPZ3TeuaBGe8P1w="
    },
    "ts": "2026-10-28T19:05:16.038215Z"
  },
  {
    "index": 7,
    "type": "migration_wave",
    "payload_hash": "e789be225647d4ba8adde1ba5a0108f88b871231a5cb4e7f21c9fc8cda3a5518",
    "prev_hash": "05e8aead810c48fce7593ca838490fb3ccea31929e9b6a295de27fabe94cbf12",
    "sig_mldsa": {
      "algorithm": "ECDSA-SHA256",
      "status": "FALLBACK_CLASSICAL",
      "public_key_encoding": "der-base64",
      "public_key": "TUZrd0V3WUhLb1pJemowQ0FRWUlLb1pJemowREFRY0RRZ0FFLzZEUTJMK2hhd0NkL3craWExTEluSnhsSkdOUVRUVUsxN2RZM1RPekhnOWxWdmV2djVzbTArQmU5OU1iZjFOTHQyNlpMRjhTalE3VU1sQU9aU1Fkc0E9PQ==",
      "signature": "MEUCIQD4F+eGjI+1gDBA/GzTlBDGyNHT9bEmTWkh8n3AEfCpWwIgXov2odlYeqCDna2DUUAPCf7agGE6TIhwuKid4jQ/2Mw="
    },
    "ts": "2026-10-28T19:06:20.651370Z"
  },
  {
    "index": 8,
    "type": "migration_wave",
    "payload_hash": "6309bb4d7d2f88ed7b7abe85cb191ff4a455ce491690edea10a6235d2518ee7e",
    "prev_hash": "b0132656f6422bcf6249bed8b2ba319c06a5ee2efd489c0956f6858fc799c472",
    "sig_mldsa": {
      "algorithm": "ECDSA-SHA256",
      "status": "FALLBACK_CLASSICAL",
      "public_key_encoding": "der-base64",
      "public_key": "TUZrd0V3WUhLb1pJemowQ0FRWUlLb1pJemowREFRY0RRZ0FFLzZEUTJMK2hhd0NkL3craWExTEluSnhsSkdOUVRUVUsxN2RZM1RPekhnOWxWdmV2djVzbTArQmU5OU1iZjFOTHQyNlpMRjhTalE3VU1sQU9aU1Fkc0E9PQ==",
      "signature": "MEUCIHSm0js33f5DqzCKuNVnv308AFG1pITY5cqwcqI8FaMGAiEAsEJSadnTUfpDIsrnObJxZ0rzQ7/Kc/kaNpYtryDIO6s="
    },
    "ts": "2026-10-28T19:06:20.677715Z"
  },
  {
    "index": 9,
    "type": "migration_wave",
    "payload_hash": "965e43ace32b11dd3fb0af4599fe91a42927bc29843669f3040c0f75a36802ee",
    "prev_hash": "6fe39a4274eee56998ab222838358b136c29424b629f973f29e73b875f53de08",
    "sig_mldsa": {
      "algorithm": "ECDSA-SHA256",
      "status": "FALLBACK_CLASSICAL",
      "public_key_encoding": "der-base64",
      "public_key": "TUZrd0V3WUhLb1pJemowQ0FRWUlLb1pJemowREFRY0RRZ0FFLzZEUTJMK2hhd0NkL3craWExTEluSnhsSkdOUVRUVUsxN2RZM1RPekhnOWxWdmV2djVzbTArQmU5OU1iZjFOTHQyNlpMRjhTalE3VU1sQU9aU1Fkc0E9PQ==",
      "signature": "MEUCIQDHIS2XG8OwX8hjF8nryQmkpkUNZ17YSVIFsPSAdVEocAIgex8TaRoPmcShVSOfJLU87JrwTftcNaV2BsPRVl6MUvU="
    },
    "ts": "2026-10-28T19:06:20.681350Z"
  },
  {
    "index": 10,
    "type": "migration_wave",
    "payload_hash": "5e89a6081ffe52aeed13a57e8a802011dc6d8bf8d618e81145905c1c60b683d7",
    "prev_hash": "491b4fb596f7a95bc86d8702f81188ddf01eb18830ebaeec75a1773b73b004b9",
    "sig_mldsa": {
      "algorithm": "ECDSA-SHA256",
      "status": "FALLBACK_CLASSICAL",
      "public_key_encoding": "der-base64",
      "public_key": "TUZrd0V3WUhLb1pJemowQ0FRWUlLb1pJemowREFRY0RRZ0FFLzZEUTJMK2hhd0NkL3craWExTEluSnhsSkdOUVRUVUsxN2RZM1RPekhnOWxWdmV2djVzbTArQmU5OU1iZjFOTHQyNlpMRjhTalE3VU1sQU9aU1Fkc0E9PQ==",
      "signature": "MEYCIQDmJuZkxk5/aOgV1SyZkbagzHoeF3J3LD/GVLteXqXWsAIhANKBhdWD/5iNkXEZQ2PV0oM0NOmbsbAjdMqIOWNGvUcs"
    },
    "ts": "2026-10-28T19:06:20.685607Z"
  },
  {
    "index": 11,
    "type": "migration_wave",
    "payload_hash": "b43a8b7eadbfc2fd3c55ccdd92ee98cf84cd5dc5d98d0a5c99b03c5299bd6045",
    "prev_hash": "b68d52c668db9df238f937199178e2df9e2c762fe442fd0791c7e6271fcf13cc",
    "sig_mldsa": {
      "algorithm": "ECDSA-SHA256",
      "status": "FALLBACK_CLASSICAL",
      "public_key_encoding": "der-base64",
      "public_key": "TUZrd0V3WUhLb1pJemowQ0FRWUlLb1pJemowREFRY0RRZ0FFLzZEUTJMK2hhd0NkL3craWExTEluSnhsSkdOUVRUVUsxN2RZM1RPekhnOWxWdmV2djVzbTArQmU5OU1iZjFOTHQyNlpMRjhTalE3VU1sQU9aU1Fkc0E9PQ==",
      "signature": "MEYCIQDRpMgPBREEcE+HvV3w6gVFGBcgdQpzPy7PpnXP+FcVtgIhAMGtsYI0XxmWkaIRYCCd8Q69DBybjTsrJMngqvNvAOTR"
    },
    "ts": "2026-10-28T19:06:20.690440Z"
  },
  {
    "index": 12,
    "type": "migration_wave",
    "payload_hash": "bd43229d384fd82075751486d64eda86886332e70457f12b05736d2b63609a9a",
    "prev_hash": "9809d23ba9d7c400a92937cc28bc1168e5e0c1308274f7be83ccbd0d70524a37",
    "sig_mldsa": {
      "algorithm": "ECDSA-SHA256",
      "status": "FALLBACK_CLASSICAL",
      "public_key_encoding": "der-base64",
      "public_key": "TUZrd0V3WUhLb1pJemowQ0FRWUlLb1pJemowREFRY0RRZ0FFLzZEUTJMK2hhd0NkL3craWExTEluSnhsSkdOUVRUVUsxN2RZM1RPekhnOWxWdmV2djVzbTArQmU5OU1iZjFOTHQyNlpMRjhTalE3VU1sQU9aU1Fkc0E9PQ==",
      "signature": "MEUCIQDFZfTmV7U3GgcHZDQvNEUZUXE0DhSgYw7fQENYmm60YAIgVs9fLhWa+FWPYgeIIfW0si5GHi9tbaXNBFXw9BabU6w="
    },
    "ts": "2026-10-28T19:06:20.700375Z"
  },
  {
    "index": 13,
    "type": "run_manifest",
    "payload_hash": "9d89ab2c245208fa7dcaf191a3d7c771db5f33230b28880b673e580643c972a5",
    "prev_hash": "f55e4cf881fb74138a3e27434d884a4a6860dbf31e4a0608dc6c2857ca03a51e",
    "sig_mldsa": {
      "algorithm": "ECDSA-SHA256",
      "status": "FALLBACK_CLASSICAL",
      "public_key_encoding": "der-base64",
      "public_key": "TUZrd0V3WUhLb1pJemowQ0FRWUlLb1pJemowREFRY0RRZ0FFLzZEUTJMK2hhd0NkL3craWExTEluSnhsSkdOUVRUVUsxN2RZM1RPekhnOWxWdmV2djVzbTArQmU5OU1iZjFOTHQyNlpMRjhTalE3VU1sQU9aU1Fkc0E9PQ==",